{
  "host": "127.0.0.1",
  "port": 7677,
  "allowedRoots": ["."],
  "allowedHosts": ["localhost", "127.0.0.1", "::1"],
  "publicBaseUrl": "http://127.0.0.1:7677",
  "stateDir": ".forgerelay-debug/state",
  "worktreeRoot": ".forgerelay-debug/worktrees",
  "artifactsEnabled": false,
  "subagents": false,
  "hooks": {
    "WorkspaceOpen": [
      { "command": "node --input-type=module -e \"import { pathToFileURL } from 'node:url'; await import(pathToFileURL(process.env.FORGERELAY_DEBUG_HOOK_RECORDER).href)\"", "timeoutSeconds": 10, "report": false }
    ],
    "BeforeTool": [
      { "command": "node --input-type=module -e \"import { pathToFileURL } from 'node:url'; await import(pathToFileURL(process.env.FORGERELAY_DEBUG_HOOK_RECORDER).href)\"", "timeoutSeconds": 10, "report": false }
    ],
    "AfterTool": [
      { "command": "node --input-type=module -e \"import { pathToFileURL } from 'node:url'; await import(pathToFileURL(process.env.FORGERELAY_DEBUG_HOOK_RECORDER).href)\"", "timeoutSeconds": 10, "report": false }
    ],
    "AfterToolFailure": [
      { "command": "node --input-type=module -e \"import { pathToFileURL } from 'node:url'; await import(pathToFileURL(process.env.FORGERELAY_DEBUG_HOOK_RECORDER).href)\"", "timeoutSeconds": 10, "report": false }
    ],
    "AfterFileChange": [
      { "command": "node --input-type=module -e \"import { pathToFileURL } from 'node:url'; await import(pathToFileURL(process.env.FORGERELAY_DEBUG_HOOK_RECORDER).href)\"", "timeoutSeconds": 10, "report": false }
    ],
    "BeforeWorktreeClose": [
      { "command": "node --input-type=module -e \"import { pathToFileURL } from 'node:url'; await import(pathToFileURL(process.env.FORGERELAY_DEBUG_HOOK_RECORDER).href)\"", "timeoutSeconds": 10, "report": false }
    ],
    "AfterWorktreeClose": [
      { "command": "node --input-type=module -e \"import { pathToFileURL } from 'node:url'; await import(pathToFileURL(process.env.FORGERELAY_DEBUG_HOOK_RECORDER).href)\"", "timeoutSeconds": 10, "report": false }
    ],
    "SubagentStart": [
      { "command": "node --input-type=module -e \"import { pathToFileURL } from 'node:url'; await import(pathToFileURL(process.env.FORGERELAY_DEBUG_HOOK_RECORDER).href)\"", "timeoutSeconds": 10, "report": false }
    ],
    "SubagentStop": [
      { "command": "node --input-type=module -e \"import { pathToFileURL } from 'node:url'; await import(pathToFileURL(process.env.FORGERELAY_DEBUG_HOOK_RECORDER).href)\"", "timeoutSeconds": 10, "report": false }
    ]
  }
}
